{
  "$schema": "http://json-schema.org/draft-07/schema#",
  "title": "Requirement",
  "type": "object",
  "required": ["id", "title", "steps"],
  "properties": {
    "id": { "type": "string", "description": "Requirement identifier (e.g., FR-FA-01)" },
    "title": { "type": "string" },
    "description": { "type": "string" },
    "sourceUrl": { "type": "string", "format": "uri" },
    "priority": { "type": "string", "enum": ["low","medium","high"], "default": "medium" },
    "confidence": { "type": "number", "minimum": 0, "maximum": 1, "default": 0.9 },
    "steps": {
      "type": "array",
      "items": {
        "type": "object",
        "required": ["action"],
        "properties": {
          "action": { "type": "string" },
          "targetHint": { "type": "string" },
          "value": { "type": ["string","number","null"] },
          "expected": { "type": "string" },
          "targetLocator": {
            "type": "object",
            "properties": {
              "type": { "type": "string" },
              "value": { "type": "string" },
              "suggested": { "type": "string" }
            }
          }
        }
      }
    }
  }
}
